"No.","Time","Source","Destination","Protocol","Length","Info"
"4","0.025210900","10.9.2.132","157.240.195.56","TCP","66","41722  >  443 [ACK] Seq=1 Ack=1 Win=3037 Len=0 TSval=1552085129 TSecr=2426549570"
"210","3.009180188","10.9.2.132","72.246.151.26","TCP","66","37250  >  80 [ACK] Seq=1 Ack=1 Win=501 Len=0 TSval=2399889623 TSecr=571320278"
"211","3.009203700","10.9.2.132","72.246.151.26","TCP","66","37236  >  80 [ACK] Seq=1 Ack=1 Win=501 Len=0 TSval=2399889623 TSecr=571320278"
"212","3.009208957","10.9.2.132","72.246.151.26","TCP","66","37244  >  80 [ACK] Seq=1 Ack=1 Win=501 Len=0 TSval=2399889623 TSecr=571320278"
"213","3.009217485","10.9.2.132","72.246.151.26","TCP","66","37254  >  80 [ACK] Seq=1 Ack=1 Win=501 Len=0 TSval=2399889623 TSecr=571320278"
"214","3.009222081","10.9.2.132","72.246.151.26","TCP","66","37262  >  80 [ACK] Seq=1 Ack=1 Win=501 Len=0 TSval=2399889623 TSecr=571320278"
"215","3.011849281","72.246.151.26","10.9.2.132","TCP","66","[TCP ACKed unseen segment] 80  >  37262 [ACK] Seq=1 Ack=2 Win=506 Len=0 TSval=571330518 TSecr=2399868935"
"216","3.011849701","72.246.151.26","10.9.2.132","TCP","66","[TCP ACKed unseen segment] 80  >  37236 [ACK] Seq=1 Ack=2 Win=506 Len=0 TSval=571330518 TSecr=2399868936"
"217","3.011849792","72.246.151.26","10.9.2.132","TCP","66","[TCP ACKed unseen segment] 80  >  37250 [ACK] Seq=1 Ack=2 Win=506 Len=0 TSval=571330518 TSecr=2399868934"
"218","3.011936861","72.246.151.26","10.9.2.132","TCP","66","[TCP ACKed unseen segment] 80  >  37254 [ACK] Seq=1 Ack=2 Win=506 Len=0 TSval=571330518 TSecr=2399868934"
"219","3.011936672","72.246.151.26","10.9.2.132","TCP","66","[TCP ACKed unseen segment] 80  >  37244 [ACK] Seq=1 Ack=2 Win=506 Len=0 TSval=571330518 TSecr=2399868934"
"515","5.561654707","10.9.2.132","104.199.65.124","SSL","77","Continuation Data"
"524","5.628796120","104.199.65.124","10.9.2.132","SSL","77","Continuation Data"
"525","5.628839417","10.9.2.132","104.199.65.124","TCP","66","52614  >  443 [ACK] Seq=12 Ack=12 Win=501 Len=0 TSval=3762964827 TSecr=3015722915"
"1083","12.427604532","157.240.195.56","10.9.2.132","TLSv1.2","143","Application Data"
"1084","12.427625028","10.9.2.132","157.240.195.56","TCP","66","41722  >  443 [ACK] Seq=1 Ack=78 Win=3037 Len=0 TSval=1552097531 TSecr=2426562012"
"1085","12.430167928","157.240.195.56","10.9.2.132","TLSv1.2","143","Application Data"
"1086","12.430182081","10.9.2.132","157.240.195.56","TCP","66","41722  >  443 [ACK] Seq=1 Ack=155 Win=3037 Len=0 TSval=1552097534 TSecr=2426562015"
"1098","12.596958542","157.240.195.56","10.9.2.132","TLSv1.2","1669","Application Data, Application Data"
"1099","12.597016293","10.9.2.132","157.240.195.56","TCP","66","41722  >  443 [ACK] Seq=1 Ack=1758 Win=3063 Len=0 TSval=1552097701 TSecr=2426562181"
"1114","12.683768283","10.9.2.132","157.240.195.56","TLSv1.2","141","Application Data"
"1115","12.707553576","10.9.2.132","157.240.195.56","TLSv1.2","162","Application Data"
"1119","12.725342024","157.240.195.56","10.9.2.132","TCP","66","443  >  41722 [ACK] Seq=1758 Ack=76 Win=1074 Len=0 TSval=2426562309 TSecr=1552097788"
"1125","12.749100988","157.240.195.56","10.9.2.132","TCP","66","443  >  41722 [ACK] Seq=1758 Ack=172 Win=1074 Len=0 TSval=2426562334 TSecr=1552097811"
"1126","12.755861257","10.9.2.132","192.114.147.162","QUIC","1399","Initial, DCID=164e344c221b5092, SCID=44bcfb, PKN: 0, CRYPTO"
"1127","12.759381792","192.114.147.162","10.9.2.132","QUIC","1274","Initial, DCID=44bcfb, SCID=808100134d768528, PKN: 9260337, CRYPTO, ACK, PADDING"
"1141","12.835001830","157.240.195.56","10.9.2.132","TLSv1.2","1088","Application Data"
"1142","12.835032622","10.9.2.132","157.240.195.56","TCP","66","41722  >  443 [ACK] Seq=172 Ack=2780 Win=3084 Len=0 TSval=1552097939 TSecr=2426562419"
"1379","13.249190457","10.9.2.132","72.246.151.26","TCP","66","[TCP Dup ACK 210#1] 37250  >  80 [ACK] Seq=1 Ack=1 Win=501 Len=0 TSval=2399899863 TSecr=571330518"
"1380","13.249215924","10.9.2.132","72.246.151.26","TCP","66","[TCP Dup ACK 211#1] 37236  >  80 [ACK] Seq=1 Ack=1 Win=501 Len=0 TSval=2399899863 TSecr=571330518"
"1381","13.249220628","10.9.2.132","72.246.151.26","TCP","66","[TCP Dup ACK 212#1] 37244  >  80 [ACK] Seq=1 Ack=1 Win=501 Len=0 TSval=2399899863 TSecr=571330518"
"1382","13.249226123","10.9.2.132","72.246.151.26","TCP","66","[TCP Dup ACK 213#1] 37254  >  80 [ACK] Seq=1 Ack=1 Win=501 Len=0 TSval=2399899863 TSecr=571330518"
"1383","13.249230518","10.9.2.132","72.246.151.26","TCP","66","[TCP Dup ACK 214#1] 37262  >  80 [ACK] Seq=1 Ack=1 Win=501 Len=0 TSval=2399899863 TSecr=571330518"
"1384","13.253269957","72.246.151.26","10.9.2.132","TCP","66","[TCP Dup ACK 218#1] 80  >  37254 [ACK] Seq=1 Ack=2 Win=506 Len=0 TSval=571340758 TSecr=2399868934"
"1385","13.253269142","72.246.151.26","10.9.2.132","TCP","66","[TCP Dup ACK 219#1] 80  >  37244 [ACK] Seq=1 Ack=2 Win=506 Len=0 TSval=571340758 TSecr=2399868934"
"1386","13.253269782","72.246.151.26","10.9.2.132","TCP","66","[TCP Dup ACK 216#1] 80  >  37236 [ACK] Seq=1 Ack=2 Win=506 Len=0 TSval=571340758 TSecr=2399868936"
"1387","13.253269616","72.246.151.26","10.9.2.132","TCP","66","[TCP Dup ACK 215#1] 80  >  37262 [ACK] Seq=1 Ack=2 Win=506 Len=0 TSval=571340758 TSecr=2399868935"
"1388","13.253269883","72.246.151.26","10.9.2.132","TCP","66","[TCP Dup ACK 217#1] 80  >  37250 [ACK] Seq=1 Ack=2 Win=506 Len=0 TSval=571340758 TSecr=2399868934"
"1635","17.714517418","10.9.2.132","35.186.224.47","TLSv1.2","109","Application Data"
"1636","17.720408394","35.186.224.47","10.9.2.132","TCP","66","443  >  54342 [ACK] Seq=1 Ack=44 Win=269 Len=0 TSval=3380804201 TSecr=38432468"
"1642","17.785780386","35.186.224.47","10.9.2.132","TLSv1.2","106","Application Data"
"1643","17.785812713","10.9.2.132","35.186.224.47","TCP","66","54342  >  443 [ACK] Seq=44 Ack=41 Win=501 Len=0 TSval=38432540 TSecr=3380804267"
"1753","18.347629034","10.9.2.132","157.240.195.56","TLSv1.2","174","Application Data"
"1813","18.388639156","157.240.195.56","10.9.2.132","TCP","66","443  >  41722 [ACK] Seq=2780 Ack=280 Win=1074 Len=0 TSval=2426567973 TSecr=1552103451"
"1842","18.498611707","157.240.195.56","10.9.2.132","TLSv1.2","161","Application Data"
"1843","18.498643037","10.9.2.132","157.240.195.56","TCP","66","41722  >  443 [ACK] Seq=280 Ack=2875 Win=3084 Len=0 TSval=1552103602 TSecr=2426568083"
"2860","19.168425668","10.9.2.132","157.240.195.56","TLSv1.2","96","Application Data"
"2861","19.168449425","10.9.2.132","157.240.195.56","TCP","4170","41722  >  443 [PSH, ACK] Seq=310 Ack=2875 Win=3084 Len=4104 TSval=1552104272 TSecr=2426568083 [TCP segment of a reassembled PDU]"
"2862","19.168941922","10.9.2.132","157.240.195.56","TLSv1.2","1391","Application Data"
"2868","19.209638172","157.240.195.56","10.9.2.132","TCP","66","443  >  41722 [ACK] Seq=2875 Ack=310 Win=1074 Len=0 TSval=2426568794 TSecr=1552104272"
"2869","19.209638341","157.240.195.56","10.9.2.132","TCP","66","443  >  41722 [ACK] Seq=2875 Ack=1678 Win=1085 Len=0 TSval=2426568794 TSecr=1552104272"
"2870","19.209638355","157.240.195.56","10.9.2.132","TCP","66","443  >  41722 [ACK] Seq=2875 Ack=3046 Win=1096 Len=0 TSval=2426568794 TSecr=1552104272"
"2871","19.210007046","157.240.195.56","10.9.2.132","TCP","66","443  >  41722 [ACK] Seq=2875 Ack=4414 Win=1106 Len=0 TSval=2426568795 TSecr=1552104272"
"2872","19.210575452","157.240.195.56","10.9.2.132","TCP","66","443  >  41722 [ACK] Seq=2875 Ack=5739 Win=1117 Len=0 TSval=2426568795 TSecr=1552104273"
"2906","19.383411845","157.240.195.56","10.9.2.132","TLSv1.2","177","Application Data"
"2907","19.383452687","10.9.2.132","157.240.195.56","TCP","66","41722  >  443 [ACK] Seq=5739 Ack=2986 Win=3084 Len=0 TSval=1552104487 TSecr=2426568967"
"2912","19.454536958","10.9.2.132","157.240.195.56","TLSv1.2","96","Application Data"
"2913","19.454568641","10.9.2.132","157.240.195.56","TCP","4170","41722  >  443 [PSH, ACK] Seq=5769 Ack=2986 Win=3084 Len=4104 TSval=1552104558 TSecr=2426568967 [TCP segment of a reassembled PDU]"
"2914","19.455045446","10.9.2.132","157.240.195.56","TLSv1.2","990","Application Data"
"2919","19.496757515","157.240.195.56","10.9.2.132","TCP","66","443  >  41722 [ACK] Seq=2986 Ack=5769 Win=1117 Len=0 TSval=2426569080 TSecr=1552104558"
"2920","19.496757653","157.240.195.56","10.9.2.132","TCP","66","443  >  41722 [ACK] Seq=2986 Ack=8505 Win=1138 Len=0 TSval=2426569080 TSecr=1552104558"
"2921","19.496757668","157.240.195.56","10.9.2.132","TCP","66","443  >  41722 [ACK] Seq=2986 Ack=9873 Win=1149 Len=0 TSval=2426569080 TSecr=1552104558"
"2922","19.496757683","157.240.195.56","10.9.2.132","TCP","66","443  >  41722 [ACK] Seq=2986 Ack=10797 Win=1160 Len=0 TSval=2426569081 TSecr=1552104559"
"2932","19.666179052","157.240.195.56","10.9.2.132","TLSv1.2","177","Application Data"
"2933","19.666214965","10.9.2.132","157.240.195.56","TCP","66","41722  >  443 [ACK] Seq=10797 Ack=3097 Win=3084 Len=0 TSval=1552104770 TSecr=2426569251"
"2937","19.715868741","157.240.195.56","10.9.2.132","TLSv1.2","163","Application Data"
"2938","19.715902802","10.9.2.132","157.240.195.56","TCP","66","41722  >  443 [ACK] Seq=10797 Ack=3194 Win=3084 Len=0 TSval=1552104820 TSecr=2426569301"
"2941","19.745149424","10.9.2.132","157.240.195.56","TLSv1.2","96","Application Data"
"2942","19.745184278","10.9.2.132","157.240.195.56","TCP","4170","41722  >  443 [PSH, ACK] Seq=10827 Ack=3194 Win=3084 Len=4104 TSval=1552104849 TSecr=2426569301 [TCP segment of a reassembled PDU]"
"2943","19.746090467","10.9.2.132","157.240.195.56","TLSv1.2","1294","Application Data"
"2945","19.786575361","157.240.195.56","10.9.2.132","TCP","66","443  >  41722 [ACK] Seq=3194 Ack=10827 Win=1160 Len=0 TSval=2426569371 TSecr=1552104849"
"2946","19.786810955","157.240.195.56","10.9.2.132","TCP","66","443  >  41722 [ACK] Seq=3194 Ack=13563 Win=1181 Len=0 TSval=2426569371 TSecr=1552104849"
"2947","19.786810978","157.240.195.56","10.9.2.132","TCP","66","443  >  41722 [ACK] Seq=3194 Ack=14931 Win=1192 Len=0 TSval=2426569371 TSecr=1552104849"
"2948","19.787193476","157.240.195.56","10.9.2.132","TCP","66","443  >  41722 [ACK] Seq=3194 Ack=16159 Win=1202 Len=0 TSval=2426569372 TSecr=1552104850"
"2951","19.905216012","10.9.2.132","35.186.224.25","TCP","66","57338  >  443 [ACK] Seq=1 Ack=1 Win=501 Len=0 TSval=2958791192 TSecr=193131266"
"2952","19.908831086","35.186.224.25","10.9.2.132","TCP","66","[TCP ACKed unseen segment] 443  >  57338 [ACK] Seq=1 Ack=2 Win=270 Len=0 TSval=193176321 TSecr=2958385054"
"2959","19.987048962","157.240.195.56","10.9.2.132","TLSv1.2","177","Application Data"
"2960","19.987049099","157.240.195.56","10.9.2.132","TLSv1.2","163","Application Data"
"2961","19.987144733","10.9.2.132","157.240.195.56","TCP","66","41722  >  443 [ACK] Seq=16159 Ack=3402 Win=3084 Len=0 TSval=1552105091 TSecr=2426569571"
"2969","20.030087561","10.9.2.132","157.240.195.56","TLSv1.2","96","Application Data"
"2970","20.030110223","10.9.2.132","157.240.195.56","TCP","4170","41722  >  443 [PSH, ACK] Seq=16189 Ack=3402 Win=3084 Len=4104 TSval=1552105134 TSecr=2426569571 [TCP segment of a reassembled PDU]"
"2971","20.031069420","10.9.2.132","157.240.195.56","TLSv1.2","414","Application Data"
"2972","20.038269222","157.240.195.56","10.9.2.132","TLSv1.2","162","Application Data"
"2973","20.071397148","157.240.195.56","10.9.2.132","TCP","66","443  >  41722 [ACK] Seq=3498 Ack=16189 Win=1202 Len=0 TSval=2426569656 TSecr=1552105134"
"2974","20.071397275","157.240.195.56","10.9.2.132","TCP","66","443  >  41722 [ACK] Seq=3498 Ack=17557 Win=1213 Len=0 TSval=2426569656 TSecr=1552105134"
"2975","20.071430502","10.9.2.132","157.240.195.56","TCP","66","41722  >  443 [ACK] Seq=20641 Ack=3498 Win=3084 Len=0 TSval=1552105175 TSecr=2426569623"
"2976","20.072417106","157.240.195.56","10.9.2.132","TCP","66","443  >  41722 [ACK] Seq=3498 Ack=18925 Win=1224 Len=0 TSval=2426569656 TSecr=1552105134"
"2977","20.072417168","157.240.195.56","10.9.2.132","TCP","66","443  >  41722 [ACK] Seq=3498 Ack=20293 Win=1234 Len=0 TSval=2426569656 TSecr=1552105134"
"2978","20.072417187","157.240.195.56","10.9.2.132","TCP","66","443  >  41722 [ACK] Seq=3498 Ack=20641 Win=1245 Len=0 TSval=2426569657 TSecr=1552105135"
"2984","20.278570681","157.240.195.56","10.9.2.132","TLSv1.2","177","Application Data"
"2985","20.278570740","157.240.195.56","10.9.2.132","TLSv1.2","162","Application Data"
"2986","20.278662681","10.9.2.132","157.240.195.56","TCP","66","41722  >  443 [ACK] Seq=20641 Ack=3705 Win=3084 Len=0 TSval=1552105382 TSecr=2426569809"
"2989","20.302694652","10.9.2.132","157.240.195.56","TLSv1.2","162","Application Data"
"2990","20.302796300","10.9.2.132","157.240.195.56","TLSv1.2","257","Application Data, Application Data"
"2991","20.303347911","10.9.2.132","157.240.195.56","TLSv1.2","161","Application Data"
"2992","20.326630536","157.240.195.56","10.9.2.132","TLSv1.2","163","Application Data"
"2993","20.328863246","10.9.2.132","157.240.195.56","TLSv1.2","162","Application Data"
"2994","20.344121316","157.240.195.56","10.9.2.132","TCP","66","443  >  41722 [ACK] Seq=3802 Ack=20737 Win=1245 Len=0 TSval=2426569929 TSecr=1552105406"
"2995","20.344444203","157.240.195.56","10.9.2.132","TCP","66","443  >  41722 [ACK] Seq=3802 Ack=20928 Win=1256 Len=0 TSval=2426569929 TSecr=1552105407"
"2996","20.344444261","157.240.195.56","10.9.2.132","TCP","66","443  >  41722 [ACK] Seq=3802 Ack=21023 Win=1256 Len=0 TSval=2426569929 TSecr=1552105407"
"2999","20.369837009","157.240.195.56","10.9.2.132","TCP","66","443  >  41722 [ACK] Seq=3802 Ack=21119 Win=1256 Len=0 TSval=2426569954 TSecr=1552105433"
"3003","20.488501839","157.240.195.56","10.9.2.132","TLSv1.2","162","Application Data"
"3004","20.493213343","10.9.2.132","157.240.195.56","TLSv1.2","161","Application Data"
"3007","20.511792032","157.240.195.56","10.9.2.132","TLSv1.2","163","Application Data"
"3008","20.514150441","10.9.2.132","157.240.195.56","TLSv1.2","162","Application Data"
"3013","20.535214016","157.240.195.56","10.9.2.132","TCP","66","443  >  41722 [ACK] Seq=3995 Ack=21214 Win=1256 Len=0 TSval=2426570120 TSecr=1552105597"
"3014","20.555419828","157.240.195.56","10.9.2.132","TCP","66","443  >  41722 [ACK] Seq=3995 Ack=21310 Win=1256 Len=0 TSval=2426570140 TSecr=1552105618"
"3022","20.705694364","157.240.195.56","10.9.2.132","TLSv1.2","162","Application Data"
"3023","20.712540728","10.9.2.132","157.240.195.56","TLSv1.2","161","Application Data"
"3025","20.753527323","157.240.195.56","10.9.2.132","TCP","66","443  >  41722 [ACK] Seq=4091 Ack=21405 Win=1256 Len=0 TSval=2426570338 TSecr=1552105816"
"3259","23.489198182","10.9.2.132","72.246.151.26","TCP","66","[TCP Dup ACK 210#1] 37250  >  80 [ACK] Seq=1 Ack=1 Win=501 Len=0 TSval=2399910103 TSecr=571340758"
"3260","23.489213904","10.9.2.132","72.246.151.26","TCP","66","[TCP Dup ACK 211#1] 37236  >  80 [ACK] Seq=1 Ack=1 Win=501 Len=0 TSval=2399910103 TSecr=571340758"
"3261","23.489216631","10.9.2.132","72.246.151.26","TCP","66","[TCP Dup ACK 212#1] 37244  >  80 [ACK] Seq=1 Ack=1 Win=501 Len=0 TSval=2399910103 TSecr=571340758"
"3262","23.489218950","10.9.2.132","72.246.151.26","TCP","66","[TCP Dup ACK 213#1] 37254  >  80 [ACK] Seq=1 Ack=1 Win=501 Len=0 TSval=2399910103 TSecr=571340758"
"3263","23.489221041","10.9.2.132","72.246.151.26","TCP","66","[TCP Dup ACK 214#1] 37262  >  80 [ACK] Seq=1 Ack=1 Win=501 Len=0 TSval=2399910103 TSecr=571340758"
"3264","23.491787138","72.246.151.26","10.9.2.132","TCP","66","[TCP Dup ACK 219#2] 80  >  37244 [ACK] Seq=1 Ack=2 Win=506 Len=0 TSval=571350997 TSecr=2399868934"
"3265","23.491786547","72.246.151.26","10.9.2.132","TCP","66","[TCP Dup ACK 218#2] 80  >  37254 [ACK] Seq=1 Ack=2 Win=506 Len=0 TSval=571350997 TSecr=2399868934"
"3266","23.491786932","72.246.151.26","10.9.2.132","TCP","66","[TCP Dup ACK 215#2] 80  >  37262 [ACK] Seq=1 Ack=2 Win=506 Len=0 TSval=571350998 TSecr=2399868935"
"3267","23.491787673","72.246.151.26","10.9.2.132","TCP","66","[TCP Dup ACK 216#2] 80  >  37236 [ACK] Seq=1 Ack=2 Win=506 Len=0 TSval=571350997 TSecr=2399868936"
"3268","23.491787752","72.246.151.26","10.9.2.132","TCP","66","[TCP Dup ACK 217#2] 80  >  37250 [ACK] Seq=1 Ack=2 Win=506 Len=0 TSval=571350997 TSecr=2399868934"
"3754","27.918974817","10.9.2.132","35.186.224.47","TLSv1.2","101","Application Data"
"3755","27.922274289","35.186.224.47","10.9.2.132","TCP","66","443  >  54370 [ACK] Seq=1 Ack=36 Win=267 Len=0 TSval=3889912242 TSecr=38442673"
"3763","27.977398269","35.186.224.47","10.9.2.132","TLSv1.2","97","Application Data"
"3764","27.977436188","10.9.2.132","35.186.224.47","TCP","66","54370  >  443 [ACK] Seq=36 Ack=32 Win=501 Len=0 TSval=38442731 TSecr=3889912297"
"3789","28.098180030","10.9.2.132","35.186.224.25","TCP","66","39112  >  443 [ACK] Seq=1 Ack=1 Win=501 Len=0 TSval=2958799385 TSecr=667857272"
"3790","28.102489109","35.186.224.25","10.9.2.132","TCP","66","[TCP ACKed unseen segment] 443  >  39112 [ACK] Seq=1 Ack=2 Win=289 Len=0 TSval=667903853 TSecr=2958752804"
"4060","32.193202754","10.9.2.132","35.186.224.25","TCP","66","36268  >  443 [ACK] Seq=1 Ack=1 Win=501 Len=0 TSval=2958803480 TSecr=2086961800"
"4061","32.196204995","35.186.224.25","10.9.2.132","TCP","66","[TCP ACKed unseen segment] 443  >  36268 [ACK] Seq=1 Ack=2 Win=261 Len=0 TSval=2087009240 TSecr=2958756084"
"4791","33.730206775","10.9.2.132","72.246.151.26","TCP","66","[TCP Dup ACK 210#1] 37250  >  80 [ACK] Seq=1 Ack=1 Win=501 Len=0 TSval=2399920344 TSecr=571350997"
"4792","33.730222224","10.9.2.132","72.246.151.26","TCP","66","[TCP Dup ACK 211#1] 37236  >  80 [ACK] Seq=1 Ack=1 Win=501 Len=0 TSval=2399920344 TSecr=571350997"
"4793","33.730225397","10.9.2.132","72.246.151.26","TCP","66","[TCP Dup ACK 212#1] 37244  >  80 [ACK] Seq=1 Ack=1 Win=501 Len=0 TSval=2399920344 TSecr=571350997"
"4794","33.730227755","10.9.2.132","72.246.151.26","TCP","66","[TCP Dup ACK 213#1] 37254  >  80 [ACK] Seq=1 Ack=1 Win=501 Len=0 TSval=2399920344 TSecr=571350997"
"4795","33.730230505","10.9.2.132","72.246.151.26","TCP","66","[TCP Dup ACK 214#1] 37262  >  80 [ACK] Seq=1 Ack=1 Win=501 Len=0 TSval=2399920344 TSecr=571350998"
"4796","33.732685467","72.246.151.26","10.9.2.132","TCP","66","[TCP Dup ACK 218#3] 80  >  37254 [ACK] Seq=1 Ack=2 Win=506 Len=0 TSval=571361238 TSecr=2399868934"
"4797","33.732685681","72.246.151.26","10.9.2.132","TCP","66","[TCP Dup ACK 219#3] 80  >  37244 [ACK] Seq=1 Ack=2 Win=506 Len=0 TSval=571361238 TSecr=2399868934"
"4798","33.732685577","72.246.151.26","10.9.2.132","TCP","66","[TCP Dup ACK 215#3] 80  >  37262 [ACK] Seq=1 Ack=2 Win=506 Len=0 TSval=571361238 TSecr=2399868935"
"4799","33.732686220","72.246.151.26","10.9.2.132","TCP","66","[TCP Dup ACK 217#3] 80  >  37250 [ACK] Seq=1 Ack=2 Win=506 Len=0 TSval=571361238 TSecr=2399868934"
"4800","33.732686323","72.246.151.26","10.9.2.132","TCP","66","[TCP Dup ACK 216#3] 80  >  37236 [ACK] Seq=1 Ack=2 Win=506 Len=0 TSval=571361238 TSecr=2399868936"
"5010","33.932494358","10.9.2.132","157.240.195.56","TLSv1.2","96","Application Data"
"5011","33.932505918","10.9.2.132","157.240.195.56","TCP","4170","41722  >  443 [PSH, ACK] Seq=21435 Ack=4091 Win=3084 Len=4104 TSval=1552119036 TSecr=2426570338 [TCP segment of a reassembled PDU]"
"5012","33.933220450","10.9.2.132","157.240.195.56","TLSv1.2","1102","Application Data"
"5057","33.991660309","157.240.195.56","10.9.2.132","TCP","66","443  >  41722 [ACK] Seq=4091 Ack=21435 Win=1256 Len=0 TSval=2426583576 TSecr=1552119036"
"5058","33.991660474","157.240.195.56","10.9.2.132","TCP","66","443  >  41722 [ACK] Seq=4091 Ack=22803 Win=1267 Len=0 TSval=2426583576 TSecr=1552119036"
"5059","33.991660492","157.240.195.56","10.9.2.132","TCP","66","443  >  41722 [ACK] Seq=4091 Ack=24171 Win=1277 Len=0 TSval=2426583577 TSecr=1552119036"
"5060","33.992530455","157.240.195.56","10.9.2.132","TCP","66","443  >  41722 [ACK] Seq=4091 Ack=25539 Win=1288 Len=0 TSval=2426583577 TSecr=1552119036"
"5061","33.992530481","157.240.195.56","10.9.2.132","TCP","66","443  >  41722 [ACK] Seq=4091 Ack=26575 Win=1299 Len=0 TSval=2426583577 TSecr=1552119037"
"5070","34.175756554","157.240.195.56","10.9.2.132","TLSv1.2","177","Application Data"
"5071","34.216176792","10.9.2.132","157.240.195.56","TCP","66","41722  >  443 [ACK] Seq=26575 Ack=4202 Win=3084 Len=0 TSval=1552119320 TSecr=2426583760"
"5144","34.451920447","157.240.195.56","10.9.2.132","TLSv1.2","163","Application Data"
"5145","34.451967300","10.9.2.132","157.240.195.56","TCP","66","41722  >  443 [ACK] Seq=26575 Ack=4299 Win=3084 Len=0 TSval=1552119556 TSecr=2426584036"
"5149","34.504173223","10.9.2.132","157.240.195.56","TLSv1.2","96","Application Data"
"5150","34.504209475","10.9.2.132","157.240.195.56","TCP","4170","41722  >  443 [PSH, ACK] Seq=26605 Ack=4299 Win=3084 Len=4104 TSval=1552119608 TSecr=2426584036 [TCP segment of a reassembled PDU]"
"5151","34.504473127","10.9.2.132","157.240.195.56","TLSv1.2","2766","Application Data"
"5160","34.545366298","157.240.195.56","10.9.2.132","TCP","66","443  >  41722 [ACK] Seq=4299 Ack=26605 Win=1299 Len=0 TSval=2426584130 TSecr=1552119608"
"5161","34.545739459","157.240.195.56","10.9.2.132","TCP","66","443  >  41722 [ACK] Seq=4299 Ack=27973 Win=1309 Len=0 TSval=2426584130 TSecr=1552119608"
"5162","34.545739617","157.240.195.56","10.9.2.132","TCP","66","443  >  41722 [ACK] Seq=4299 Ack=29341 Win=1320 Len=0 TSval=2426584130 TSecr=1552119608"
"5163","34.545739632","157.240.195.56","10.9.2.132","TCP","66","443  >  41722 [ACK] Seq=4299 Ack=30709 Win=1331 Len=0 TSval=2426584130 TSecr=1552119608"
"5164","34.545739647","157.240.195.56","10.9.2.132","TCP","66","443  >  41722 [ACK] Seq=4299 Ack=32077 Win=1341 Len=0 TSval=2426584131 TSecr=1552119608"
"5165","34.545739662","157.240.195.56","10.9.2.132","TCP","66","443  >  41722 [ACK] Seq=4299 Ack=33409 Win=1352 Len=0 TSval=2426584131 TSecr=1552119608"
"5195","34.765274378","157.240.195.56","10.9.2.132","TLSv1.2","249","Application Data"
"5196","34.765306430","10.9.2.132","157.240.195.56","TCP","66","41722  >  443 [ACK] Seq=33409 Ack=4482 Win=3084 Len=0 TSval=1552119869 TSecr=2426584350"
"5207","34.822342630","10.9.2.132","157.240.195.56","TLSv1.2","96","Application Data"
"5208","34.822362150","10.9.2.132","157.240.195.56","TCP","5538","41722  >  443 [PSH, ACK] Seq=33439 Ack=4482 Win=3084 Len=5472 TSval=1552119926 TSecr=2426584350 [TCP segment of a reassembled PDU]"
"5209","34.823900869","10.9.2.132","157.240.195.56","TLSv1.2","646","Application Data"
"5214","34.864674315","157.240.195.56","10.9.2.132","TCP","66","443  >  41722 [ACK] Seq=4482 Ack=33439 Win=1352 Len=0 TSval=2426584449 TSecr=1552119926"
"5215","34.864674454","157.240.195.56","10.9.2.132","TCP","66","443  >  41722 [ACK] Seq=4482 Ack=34807 Win=1363 Len=0 TSval=2426584449 TSecr=1552119926"
"5216","34.864674470","157.240.195.56","10.9.2.132","TCP","66","443  >  41722 [ACK] Seq=4482 Ack=37543 Win=1384 Len=0 TSval=2426584449 TSecr=1552119926"
"5217","34.864674487","157.240.195.56","10.9.2.132","TCP","66","443  >  41722 [ACK] Seq=4482 Ack=38911 Win=1395 Len=0 TSval=2426584449 TSecr=1552119926"
"5218","34.864979599","157.240.195.56","10.9.2.132","TCP","66","443  >  41722 [ACK] Seq=4482 Ack=39491 Win=1405 Len=0 TSval=2426584450 TSecr=1552119928"
"5232","35.054407341","157.240.195.56","10.9.2.132","TLSv1.2","177","Application Data"
"5233","35.054437087","10.9.2.132","157.240.195.56","TCP","66","41722  >  443 [ACK] Seq=39491 Ack=4593 Win=3084 Len=0 TSval=1552120158 TSecr=2426584639"
"5234","35.055063764","157.240.195.56","10.9.2.132","TLSv1.2","160","Application Data"
"5235","35.055069827","10.9.2.132","157.240.195.56","TCP","66","41722  >  443 [ACK] Seq=39491 Ack=4687 Win=3084 Len=0 TSval=1552120159 TSecr=2426584639"
"5238","35.085942975","157.240.195.56","10.9.2.132","TLSv1.2","163","Application Data"
"5239","35.085975561","10.9.2.132","157.240.195.56","TCP","66","41722  >  443 [ACK] Seq=39491 Ack=4784 Win=3084 Len=0 TSval=1552120190 TSecr=2426584670"
"5240","35.102032177","10.9.2.132","157.240.195.56","TLSv1.2","96","Application Data"
"5241","35.102053700","10.9.2.132","157.240.195.56","TCP","5538","41722  >  443 [PSH, ACK] Seq=39521 Ack=4784 Win=3084 Len=5472 TSval=1552120206 TSecr=2426584670 [TCP segment of a reassembled PDU]"
"5242","35.104490817","10.9.2.132","157.240.195.56","TLSv1.2","726","Application Data"
"5250","35.143593023","157.240.195.56","10.9.2.132","TCP","66","443  >  41722 [ACK] Seq=4784 Ack=39521 Win=1405 Len=0 TSval=2426584728 TSecr=1552120206"
"5251","35.143593099","157.240.195.56","10.9.2.132","TCP","66","443  >  41722 [ACK] Seq=4784 Ack=40889 Win=1416 Len=0 TSval=2426584728 TSecr=1552120206"
"5252","35.145482468","157.240.195.56","10.9.2.132","TCP","66","443  >  41722 [ACK] Seq=4784 Ack=43625 Win=1438 Len=0 TSval=2426584730 TSecr=1552120206"
"5253","35.145482606","157.240.195.56","10.9.2.132","TCP","66","443  >  41722 [ACK] Seq=4784 Ack=44993 Win=1448 Len=0 TSval=2426584730 TSecr=1552120206"
"5254","35.146410077","157.240.195.56","10.9.2.132","TCP","66","443  >  41722 [ACK] Seq=4784 Ack=45653 Win=1459 Len=0 TSval=2426584731 TSecr=1552120208"
"5269","35.286879862","157.240.195.56","10.9.2.132","TLSv1.2","177","Application Data"
"5271","35.297138587","157.240.195.56","10.9.2.132","TLSv1.2","163","Application Data"
"5273","35.297204216","10.9.2.132","157.240.195.56","TCP","66","41722  >  443 [ACK] Seq=45653 Ack=4992 Win=3084 Len=0 TSval=1552120401 TSecr=2426584871"
"5281","35.321886423","10.9.2.132","157.240.195.56","TLSv1.2","96","Application Data"
"5282","35.321905284","10.9.2.132","157.240.195.56","TLSv1.2","4790","Application Data"
"5294","35.363823251","157.240.195.56","10.9.2.132","TCP","66","443  >  41722 [ACK] Seq=4992 Ack=45683 Win=1459 Len=0 TSval=2426584948 TSecr=1552120426"
"5295","35.363823412","157.240.195.56","10.9.2.132","TCP","66","443  >  41722 [ACK] Seq=4992 Ack=47051 Win=1470 Len=0 TSval=2426584948 TSecr=1552120426"
"5296","35.363823426","157.240.195.56","10.9.2.132","TCP","66","443  >  41722 [ACK] Seq=4992 Ack=48419 Win=1480 Len=0 TSval=2426584948 TSecr=1552120426"
"5297","35.363823441","157.240.195.56","10.9.2.132","TCP","66","443  >  41722 [ACK] Seq=4992 Ack=49787 Win=1491 Len=0 TSval=2426584948 TSecr=1552120426"
"5298","35.363823457","157.240.195.56","10.9.2.132","TCP","66","443  >  41722 [ACK] Seq=4992 Ack=50407 Win=1502 Len=0 TSval=2426584948 TSecr=1552120426"
"5311","35.458600261","10.9.2.132","157.240.195.56","TLSv1.2","162","Application Data"
"5312","35.458645587","10.9.2.132","157.240.195.56","TLSv1.2","252","Application Data, Application Data"
"5313","35.458897441","10.9.2.132","157.240.195.56","TLSv1.2","258","Application Data, Application Data"
"5320","35.499735634","157.240.195.56","10.9.2.132","TCP","66","443  >  41722 [ACK] Seq=4992 Ack=50503 Win=1502 Len=0 TSval=2426585084 TSecr=1552120562"
"5321","35.499735719","157.240.195.56","10.9.2.132","TCP","66","443  >  41722 [ACK] Seq=4992 Ack=50689 Win=1502 Len=0 TSval=2426585085 TSecr=1552120562"
"5322","35.500044546","157.240.195.56","10.9.2.132","TCP","66","443  >  41722 [ACK] Seq=4992 Ack=50881 Win=1502 Len=0 TSval=2426585085 TSecr=1552120563"
"5327","35.534673519","157.240.195.56","10.9.2.132","TLSv1.2","177","Application Data"
"5328","35.534673635","157.240.195.56","10.9.2.132","TLSv1.2","163","Application Data"
"5329","35.534673649","157.240.195.56","10.9.2.132","TLSv1.2","160","Application Data"
"5330","35.534793189","10.9.2.132","157.240.195.56","TCP","66","41722  >  443 [ACK] Seq=50881 Ack=5294 Win=3084 Len=0 TSval=1552120639 TSecr=2426585119"
"5340","35.556960660","10.9.2.132","157.240.195.56","TLSv1.2","162","Application Data"
"5341","35.557250058","10.9.2.132","157.240.195.56","TLSv1.2","159","Application Data"
"5342","35.566205782","157.240.195.56","10.9.2.132","TLSv1.2","160","Application Data"
"5343","35.571440235","10.9.2.132","157.240.195.56","TLSv1.2","159","Application Data"
"5345","35.598324934","157.240.195.56","10.9.2.132","TCP","66","443  >  41722 [ACK] Seq=5388 Ack=51070 Win=1502 Len=0 TSval=2426585183 TSecr=1552120661"
"5363","35.653365923","157.240.195.56","10.9.2.132","TCP","66","443  >  41722 [ACK] Seq=5388 Ack=51163 Win=1502 Len=0 TSval=2426585238 TSecr=1552120675"
"5376","35.753179689","157.240.195.56","10.9.2.132","TLSv1.2","163","Application Data"
"5377","35.755563834","10.9.2.132","157.240.195.56","TLSv1.2","162","Application Data"
"5384","35.796690418","157.240.195.56","10.9.2.132","TCP","66","443  >  41722 [ACK] Seq=5485 Ack=51259 Win=1502 Len=0 TSval=2426585381 TSecr=1552120859"
"5389","35.836042162","157.240.195.56","10.9.2.132","TLSv1.2","160","Application Data"
"5390","35.842342751","10.9.2.132","157.240.195.56","TLSv1.2","159","Application Data"
"5405","35.926126833","157.240.195.56","10.9.2.132","TCP","66","443  >  41722 [ACK] Seq=5579 Ack=51352 Win=1502 Len=0 TSval=2426585510 TSecr=1552120946"
"5647","38.910349469","157.240.195.56","10.9.2.132","TLSv1.2","1579","Application Data"
"5648","38.910404880","10.9.2.132","157.240.195.56","TCP","66","41722  >  443 [ACK] Seq=51352 Ack=7092 Win=3108 Len=0 TSval=1552124014 TSecr=2426588495"
"5649","38.910778339","157.240.195.56","10.9.2.132","TLSv1.2","2661","Application Data"
"5650","38.910790094","10.9.2.132","157.240.195.56","TCP","66","41722  >  443 [ACK] Seq=51352 Ack=9687 Win=3148 Len=0 TSval=1552124015 TSecr=2426588495"
"5651","38.911893189","157.240.195.56","10.9.2.132","TLSv1.2","2802","Application Data"
"5652","38.911923591","10.9.2.132","157.240.195.56","TCP","66","41722  >  443 [ACK] Seq=51352 Ack=12423 Win=3191 Len=0 TSval=1552124016 TSecr=2426588496"
"5653","38.912528517","157.240.195.56","10.9.2.132","TLSv1.2","313","Application Data"
"5654","38.955176394","10.9.2.132","157.240.195.56","TCP","66","41722  >  443 [ACK] Seq=51352 Ack=12670 Win=3191 Len=0 TSval=1552124059 TSecr=2426588497"
"5670","39.082843616","10.9.2.132","157.240.195.56","TLSv1.2","162","Application Data"
"5672","39.111361104","10.9.2.132","157.240.195.56","TLSv1.2","174","Application Data"
"5673","39.123867358","157.240.195.56","10.9.2.132","TCP","66","443  >  41722 [ACK] Seq=12670 Ack=51448 Win=1502 Len=0 TSval=2426588708 TSecr=1552124187"
"5675","39.152676947","157.240.195.56","10.9.2.132","TCP","66","443  >  41722 [ACK] Seq=12670 Ack=51556 Win=1502 Len=0 TSval=2426588737 TSecr=1552124215"
"5676","39.159589608","157.240.195.56","10.9.2.132","TLSv1.2","1579","Application Data"
"5677","39.159616411","10.9.2.132","157.240.195.56","TCP","66","41722  >  443 [ACK] Seq=51556 Ack=14183 Win=3214 Len=0 TSval=1552124263 TSecr=2426588744"
"5678","39.160079174","157.240.195.56","10.9.2.132","TLSv1.2","2661","Application Data"
"5679","39.160084706","10.9.2.132","157.240.195.56","TCP","66","41722  >  443 [ACK] Seq=51556 Ack=16778 Win=3255 Len=0 TSval=1552124264 TSecr=2426588745"
"5680","39.161179007","157.240.195.56","10.9.2.132","TLSv1.2","2521","Application Data, Application Data"
"5681","39.161190450","10.9.2.132","157.240.195.56","TCP","66","41722  >  443 [ACK] Seq=51556 Ack=19233 Win=3293 Len=0 TSval=1552124265 TSecr=2426588746"
"5688","39.196260328","157.240.195.56","10.9.2.132","TLSv1.2","239","Application Data"
"5689","39.196292430","10.9.2.132","157.240.195.56","TCP","66","41722  >  443 [ACK] Seq=51556 Ack=19406 Win=3293 Len=0 TSval=1552124300 TSecr=2426588781"
"5690","39.261365692","157.240.195.56","10.9.2.132","TLSv1.2","161","Application Data"
"5691","39.261403130","10.9.2.132","157.240.195.56","TCP","66","41722  >  443 [ACK] Seq=51556 Ack=19501 Win=3293 Len=0 TSval=1552124365 TSecr=2426588846"
"5699","39.275817812","10.9.2.132","157.240.195.56","TLSv1.2","162","Application Data"
"5729","39.285396404","10.9.2.132","157.240.195.56","TLSv1.2","161","Application Data"
"5853","39.322703502","10.9.2.132","157.240.195.56","TLSv1.2","203","Application Data"
"5863","39.326651830","157.240.195.56","10.9.2.132","TCP","66","443  >  41722 [ACK] Seq=19501 Ack=51747 Win=1502 Len=0 TSval=2426588911 TSecr=1552124380"
"5865","39.411248057","157.240.195.56","10.9.2.132","TCP","66","443  >  41722 [ACK] Seq=19501 Ack=51884 Win=1502 Len=0 TSval=2426588996 TSecr=1552124427"
"5866","39.426025068","157.240.195.56","10.9.2.132","TCP","1434","443  >  41722 [ACK] Seq=19501 Ack=51884 Win=1502 Len=1368 TSval=2426589010 TSecr=1552124427 [TCP segment of a reassembled PDU]"
"5867","39.426350802","157.240.195.56","10.9.2.132","TLSv1.2","211","Application Data"
"5868","39.426360903","10.9.2.132","157.240.195.56","TCP","66","41722  >  443 [ACK] Seq=51884 Ack=21014 Win=3315 Len=0 TSval=1552124530 TSecr=2426589010"
"5869","39.426350836","157.240.195.56","10.9.2.132","TLSv1.2","2661","Application Data"
"5870","39.426373054","10.9.2.132","157.240.195.56","TCP","66","41722  >  443 [ACK] Seq=51884 Ack=23609 Win=3355 Len=0 TSval=1552124530 TSecr=2426589010"
"5871","39.427091183","157.240.195.56","10.9.2.132","TLSv1.2","2802","Application Data"
"5872","39.427097102","10.9.2.132","157.240.195.56","TCP","66","41722  >  443 [ACK] Seq=51884 Ack=26345 Win=3398 Len=0 TSval=1552124531 TSecr=2426589011"
"5873","39.427091237","157.240.195.56","10.9.2.132","TLSv1.2","569","Application Data"
"5911","39.467174817","10.9.2.132","157.240.195.56","TCP","66","41722  >  443 [ACK] Seq=51884 Ack=26848 Win=3398 Len=0 TSval=1552124571 TSecr=2426589012"
"5918","39.474098601","157.240.195.56","10.9.2.132","TLSv1.2","161","Application Data"
"5919","39.474120020","10.9.2.132","157.240.195.56","TCP","66","41722  >  443 [ACK] Seq=51884 Ack=26943 Win=3398 Len=0 TSval=1552124578 TSecr=2426589059"
"6088","39.584713779","10.9.2.132","157.240.195.56","TLSv1.2","162","Application Data"
"6095","39.609344221","10.9.2.132","157.240.195.56","TLSv1.2","174","Application Data"
"6096","39.625994310","157.240.195.56","10.9.2.132","TCP","66","443  >  41722 [ACK] Seq=26943 Ack=51980 Win=1502 Len=0 TSval=2426589211 TSecr=1552124689"
"6097","39.650494939","157.240.195.56","10.9.2.132","TCP","66","443  >  41722 [ACK] Seq=26943 Ack=52088 Win=1502 Len=0 TSval=2426589235 TSecr=1552124713"
"6099","39.672001147","157.240.195.56","10.9.2.132","TLSv1.2","1579","Application Data"
"6100","39.672027613","10.9.2.132","157.240.195.56","TCP","66","41722  >  443 [ACK] Seq=52088 Ack=28456 Win=3422 Len=0 TSval=1552124776 TSecr=2426589256"
"6101","39.672455398","157.240.195.56","10.9.2.132","TLSv1.2","2661","Application Data"
"6102","39.672467104","10.9.2.132","157.240.195.56","TCP","66","41722  >  443 [ACK] Seq=52088 Ack=31051 Win=3462 Len=0 TSval=1552124776 TSecr=2426589257"
"6103","39.673607855","157.240.195.56","10.9.2.132","TLSv1.2","2393","Application Data, Application Data"
"6104","39.673617452","10.9.2.132","157.240.195.56","TCP","66","41722  >  443 [ACK] Seq=52088 Ack=33378 Win=3499 Len=0 TSval=1552124777 TSecr=2426589258"
"6286","39.755239536","10.9.2.132","157.240.195.56","TLSv1.2","162","Application Data"
"6315","39.761965763","10.9.2.132","157.240.195.56","TLSv1.2","203","Application Data"
"6347","39.771241680","157.240.195.56","10.9.2.132","TLSv1.2","161","Application Data"
"6348","39.771316308","10.9.2.132","157.240.195.56","TCP","66","41722  >  443 [ACK] Seq=52321 Ack=33473 Win=3499 Len=0 TSval=1552124875 TSecr=2426589344"
"6508","39.815565203","157.240.195.56","10.9.2.132","TCP","66","443  >  41722 [ACK] Seq=33473 Ack=52321 Win=1502 Len=0 TSval=2426589388 TSecr=1552124859"
"6763","39.912538161","157.240.195.56","10.9.2.132","TLSv1.2","161","Application Data"
"6764","39.912607404","10.9.2.132","157.240.195.56","TCP","66","41722  >  443 [ACK] Seq=52321 Ack=33568 Win=3499 Len=0 TSval=1552125016 TSecr=2426589497"
"6774","39.946747123","157.240.195.56","10.9.2.132","TLSv1.2","1579","Application Data"
"6775","39.946769134","10.9.2.132","157.240.195.56","TCP","66","41722  >  443 [ACK] Seq=52321 Ack=35081 Win=3522 Len=0 TSval=1552125051 TSecr=2426589531"
"6776","39.947430110","157.240.195.56","10.9.2.132","TLSv1.2","2661","Application Data"
"6777","39.947435967","10.9.2.132","157.240.195.56","TCP","66","41722  >  443 [ACK] Seq=52321 Ack=37676 Win=3563 Len=0 TSval=1552125051 TSecr=2426589532"
"6778","39.948255378","157.240.195.56","10.9.2.132","TLSv1.2","2802","Application Data"
"6779","39.948260536","10.9.2.132","157.240.195.56","TCP","66","41722  >  443 [ACK] Seq=52321 Ack=40412 Win=3606 Len=0 TSval=1552125052 TSecr=2426589533"
"6780","39.948915834","157.240.195.56","10.9.2.132","TLSv1.2","313","Application Data"
"6781","39.948930936","10.9.2.132","157.240.195.56","TCP","66","41722  >  443 [ACK] Seq=52321 Ack=40659 Win=3606 Len=0 TSval=1552125053 TSecr=2426589533"
"6786","40.021266352","10.9.2.132","157.240.195.56","TLSv1.2","162","Application Data"
"6787","40.027771364","10.9.2.132","157.240.195.56","TLSv1.2","174","Application Data"
"6788","40.068992776","157.240.195.56","10.9.2.132","TCP","66","443  >  41722 [ACK] Seq=40659 Ack=52525 Win=1502 Len=0 TSval=2426589653 TSecr=1552125125"
"6793","40.178133763","157.240.195.56","10.9.2.132","TLSv1.2","161","Application Data"
"6794","40.178226314","10.9.2.132","157.240.195.56","TCP","66","41722  >  443 [ACK] Seq=52525 Ack=40754 Win=3606 Len=0 TSval=1552125282 TSecr=2426589763"
"6795","40.188142129","157.240.195.56","10.9.2.132","TLSv1.2","1579","Application Data"
"6796","40.188188172","10.9.2.132","157.240.195.56","TCP","66","41722  >  443 [ACK] Seq=52525 Ack=42267 Win=3629 Len=0 TSval=1552125292 TSecr=2426589773"
"6797","40.189139045","157.240.195.56","10.9.2.132","TLSv1.2","2661","Application Data"
"6798","40.189143673","10.9.2.132","157.240.195.56","TCP","66","41722  >  443 [ACK] Seq=52525 Ack=44862 Win=3670 Len=0 TSval=1552125293 TSecr=2426589773"
"6799","40.189902565","157.240.195.56","10.9.2.132","TLSv1.2","2802","Application Data"
"6800","40.189905957","10.9.2.132","157.240.195.56","TCP","66","41722  >  443 [ACK] Seq=52525 Ack=47598 Win=3712 Len=0 TSval=1552125294 TSecr=2426589774"
"6801","40.190019427","157.240.195.56","10.9.2.132","TLSv1.2","591","Application Data, Application Data"
"6802","40.190022572","10.9.2.132","157.240.195.56","TCP","66","41722  >  443 [ACK] Seq=52525 Ack=48123 Win=3734 Len=0 TSval=1552125294 TSecr=2426589775"
"6806","40.276601704","10.9.2.132","157.240.195.56","TLSv1.2","162","Application Data"
"6807","40.286186808","10.9.2.132","157.240.195.56","TLSv1.2","174","Application Data"
"6808","40.328291931","157.240.195.56","10.9.2.132","TCP","66","443  >  41722 [ACK] Seq=48123 Ack=52729 Win=1502 Len=0 TSval=2426589912 TSecr=1552125380"
"6811","40.451090655","157.240.195.56","10.9.2.132","TLSv1.2","161","Application Data"
"6812","40.451114177","10.9.2.132","157.240.195.56","TCP","66","41722  >  443 [ACK] Seq=52729 Ack=48218 Win=3734 Len=0 TSval=1552125555 TSecr=2426590021"
"6813","40.451090738","157.240.195.56","10.9.2.132","TLSv1.2","1579","Application Data"
"6814","40.451128647","10.9.2.132","157.240.195.56","TCP","66","41722  >  443 [ACK] Seq=52729 Ack=49731 Win=3757 Len=0 TSval=1552125555 TSecr=2426590024"
"6815","40.451090753","157.240.195.56","10.9.2.132","TLSv1.2","2661","Application Data"
"6816","40.451131639","10.9.2.132","157.240.195.56","TCP","66","41722  >  443 [ACK] Seq=52729 Ack=52326 Win=3798 Len=0 TSval=1552125555 TSecr=2426590024"
"6817","40.451090769","157.240.195.56","10.9.2.132","TLSv1.2","2169","Application Data, Application Data"
"6818","40.451134595","10.9.2.132","157.240.195.56","TCP","66","41722  >  443 [ACK] Seq=52729 Ack=54429 Win=3831 Len=0 TSval=1552125555 TSecr=2426590025"
"6887","40.609747872","10.9.2.132","157.240.195.56","TLSv1.2","162","Application Data"
"6999","40.644319336","10.9.2.132","157.240.195.56","TLSv1.2","174","Application Data"
"7005","40.685523146","157.240.195.56","10.9.2.132","TCP","66","443  >  41722 [ACK] Seq=54429 Ack=52933 Win=1502 Len=0 TSval=2426590270 TSecr=1552125714"
"7010","40.755745581","10.9.2.132","34.160.144.191","TLSv1.2","112","Application Data"
"7011","40.755779421","10.9.2.132","34.149.100.209","TLSv1.2","112","Application Data"
"7012","40.755799432","10.9.2.132","34.117.121.53","TLSv1.2","112","Application Data"
"7013","40.759992373","34.160.144.191","10.9.2.132","TCP","66","443  >  36786 [ACK] Seq=1 Ack=47 Win=269 Len=0 TSval=636812654 TSecr=60630907"
